{
  "Tag": "CONEVAL2022EvalPDS",
  "SourceType": "Report",
  "AuthorType": "corporate",
  "Authors": [],
  "CorporateAuthor": { "Name": "Consejo Nacional de Evaluación de la Política de Desarrollo Social" },
  "Title": "Informe de Evaluación de la Política de Desarrollo Social 2021",
  "Year": "2022",
  "City": "Ciudad de México",
  "Publisher": "CONEVAL",
  "Institution": "CONEVAL",
  "URL": "https://www.coneval.org.mx/Evaluacion/IEPSM/Documents/EVAL_PDS_2021.pdf",
  "Notes": ""
}