{
  "Tag": "SEP2023BecasWeb",
  "SourceType": "ElectronicSource",
  "AuthorType": "corporate",
  "Authors": [],
  "CorporateAuthor": { "Name": "Secretaría de Educación Pública" },
  "Title": "Programa de Becas para el Bienestar Benito Juárez",
  "Year": "",
  "City": "",
  "Publisher": "Secretaría de Educación Pública",
  "Institution": "Secretaría de Educación Pública",
  "URL": "https://www.gob.mx/sep/articulos/programa-de-becas-para-el-bienestar-benito-juarez",
  "Notes": "No se indica año de publicación explícito; se usa 2023 por referencia al ciclo escolar mencionado en el contenido."
}