{
  "Tag": "Perez2021DesigCoh",
  "SourceType": "JournalArticle",
  "AuthorType": "person",
  "Authors": [
    { "Last": "Pérez", "First": "Juan" },
    { "Last": "López", "First": "María A." }
  ],
  "CorporateAuthor": { "Name": "" },
  "Title": "Desigualdad y cohesión social en América Latina",
  "Year": "2021",
  "City": "",
  "Publisher": "Universidad Nacional Autónoma de México",
  "Institution": "Instituto de Investigaciones Sociales, UNAM",
  "URL": "",
  "Notes": "DOI: 10.22201/iis.01882503p.2021.83.2 | Revista Mexicana de Sociología, 83(2), 245-270"
}